{"admission_checks":"pass","author_id":"codex-stage0-manual","case_id":"comedy_002","confound_controls":{"char_count_delta_ratio":0.01783628835332838,"episodes_match":true,"scene_count_match":true},"construction":"degradation","masking_virtue":["stated_motive_clarity","emotional_intensity"],"negative_artifact_id":"baseline-deepseek-v4-pro-20260727-comedy_002-seed-42-motive-explicit-stage0","pair_id":"stage0-comedy-002-motive-explicit-001","pair_kind":"seeded_degradation","positive_artifact_id":"baseline-deepseek-v4-pro-20260727-comedy_002-seed-42","rights":{"allowed_uses":["evaluation"]},"schema":"eval-adversarial-pair/v1","seeded_defects":[{"load_bearing":true,"problem_code":"MOTIVE_EXPLICIT","repair_cost":"scene_rewrite","spans":["story-package/scene-1/dialogue-1","story-package/scene-1/dialogue-2","story-package/scene-1/dialogue-3","story-package/scene-1/dialogue-4","story-package/scene-1/dialogue-5","story-package/scene-2/dialogue-1","story-package/scene-2/dialogue-2","story-package/scene-2/dialogue-3","story-package/scene-2/dialogue-4","story-package/scene-2/dialogue-5","story-package/scene-2/dialogue-6","story-package/scene-2/dialogue-7"],"target_dimension":"dialogue_subtext"}],"split":"dev","status":"candidate"}
